{
  "$id": "https://hospitrainity.curriculum/schema/source-provenance.schema.json",
  "$schema": "https://json-schema.org/draft/2020-12/schema",
  "additionalProperties": false,
  "allOf": [
    {
      "$ref": "https://hospitrainity.curriculum/schema/_meta.schema.json#/$defs/meta"
    }
  ],
  "properties": {
    "code": {
      "$ref": "https://hospitrainity.curriculum/schema/_meta.schema.json#/$defs/editorial_code"
    },
    "content_version": {
      "$ref": "https://hospitrainity.curriculum/schema/_meta.schema.json#/$defs/semver"
    },
    "entity_type": {
      "const": "source-provenance"
    },
    "excerpt_sha256": {
      "$ref": "https://hospitrainity.curriculum/schema/_meta.schema.json#/$defs/sha256"
    },
    "id": {
      "$ref": "https://hospitrainity.curriculum/schema/_meta.schema.json#/$defs/uuid"
    },
    "replaced_by": {
      "oneOf": [
        {
          "$ref": "https://hospitrainity.curriculum/schema/_meta.schema.json#/$defs/uuid"
        },
        {
          "type": "null"
        }
      ]
    },
    "replaces": {
      "oneOf": [
        {
          "$ref": "https://hospitrainity.curriculum/schema/_meta.schema.json#/$defs/uuid"
        },
        {
          "type": "null"
        }
      ]
    },
    "source_locator": {
      "$ref": "https://hospitrainity.curriculum/schema/_meta.schema.json#/$defs/source_locator"
    },
    "status": {
      "$ref": "https://hospitrainity.curriculum/schema/_meta.schema.json#/$defs/status"
    },
    "target_code": {
      "$ref": "https://hospitrainity.curriculum/schema/_meta.schema.json#/$defs/editorial_code"
    }
  },
  "required": [
    "id",
    "code",
    "content_version",
    "status",
    "entity_type",
    "source_locator",
    "target_code",
    "excerpt_sha256"
  ],
  "title": "Source provenance record",
  "type": "object"
}
